category,title,date,content,brief
1,FAO: GIÁ LƯƠNG THỰC THẾ GIỚI THÁNG 2 GIẢM LẦN ĐẦU TIÊN TRONG 4 THÁNG VÌ VIRUS CORONA,10 | 03 | 2020,"Cụ thể, chỉ số giá lương thực của FAO đã giảm 1% so với tháng 1 xuống 180,5 điểm, nhưng chỉ số tháng này vẫn tăng 8,1% so với cùng kì năm ngoái.
Nguyên nhân của sự sụt giảm là giá xuất khẩu của dầu thực vật giảm mạnh. Chỉ số giá dầu thực vật FAO đạt 158,1 điểm trong tháng 2, giảm 10,3% so với tháng 1 và dứt chuỗi tăng kéo dài từ tháng 7/2019.
Trong đó, giá dầu cọ quốc tế - thành phần quan trọng của chỉ số - đã giảm 12% so với tháng 1 vì sản lượng lớn hơn dự báo tại Malaysia và sự sụt giảm tạm thời về nhu cầu nhập khẩu dầu cọ Ấn Độ và lo ngại nhu cầu trên thế giới chậm lại sau khi virus corona (Covid-19) bùng phát.
Cơ quan của Liên Hợp Quốc nhận định lo ngại về sự lây lan của Covid-19 và Trung Quốc giảm nhập khẩu đang tác động tới thị trường.
Chỉ số giá ngũ cốc cũng giảm 0,95% trong tháng 2 với giá lúa mì giảm, phản ánh nguồn cung trên thị trường đầy đủ, trong khi giá ngô giảm vì nhu cầu từ ngành thức ăn chăn nuôi yếu trong bối cảnh nền kinh tế toàn cầu suy yếu. Ngược lại, giá gạo thế giới tăng, nổi bật bởi nhu cầu mạnh mẽ từ người mua từ Viễn Đông và Đông Phi.
Theo Reuters, giá gạo tại các nhà xuất khẩu hàng đầu thế giới cũng đang ở mức cao trong tuần trước. Tại Thái Lan, giá gạo 5% tấm tăng vọt lên 460 - 467 USD/tấn, mức cao nhất kể từ tháng 8/2013 vì hạn hán kéo dài tại nhiều vùng trồng lúa khiến thị trường lo ngại về khả năng thiếu hụt nguồn cung.
Giá gạo 5% tấm tại Việt Nam cũng lên cao nhất hơn một năm trong tuần trước, đạt 390 - 400 USD/tấn nhờ nhu cầu mạnh mẽ từ châu Phi, Cu Ba và Malaysia.
Tháng 2, chỉ số giá thịt của FAO đã giảm 2% so với tháng 1, chịu ảnh hưởng từ Trung Quốc giảm nhập khẩu khi việc bốc dỡ hàng hóa tại các cảng bị trì hoãn. Cùng với đó, hạn hán dẫn tới việc giết mổ lượng lớn tại New Zealand gây thêm áp lực đối với giá thịt bò, trong khi giá thịt gia cầm bị ảnh hưởng bởi nhu cầu nhập khẩu suy yếu tại châu Á.
Ngoài ra, lượng thu mua giảm tại Trung Quốc, nhà nhập khẩu sữa bột lớn nhất thế giới, đã khiến giá sữa bột giảm, trong khi giá phô mai tăng, một phần vì sản lượng sữa tại Australia giảm dẫn đến chỉ số giá sữa của FAO trong tháng 2 tăng 4,6% so với tháng trước đó.
Chỉ số giá đường tăng 4,5% trong bối cảnh triển vọng sản lượng giảm tại Ấn Độ cũng như ở Thái Lan với nhu cầu nhập khẩu mạnh mẽ trên thế giới, đặc biệt là từ Indonesia - nhà nhập khẩu đường lớn nhất thế giới.
Thương mại ngũ cốc ước tăng hơn 2% trong 2019 - 2020
FAO cũng phát hành dự báo mới đối với sản lượng ngũ cốc thế giới, cho biết thị trường ngũ cốc toàn cầu dự kiến duy trì đủ nguồn cung, đáp ứng được dự báo tăng trưởng về tiêu thụ.
Cơ quan của Liên Hợp Quốc cũng nâng dự báo đối với sản lượng ngũ cốc thế giới năm 2019 lên 2.719 triệu tấn vì sản lượng ngô lớn hơn tại Tây Phi và Ukraine.
Tiêu thụ ngũ cốc thế giới trong năm 2019 - 2020 được dự báo đạt kỉ lục 2.721 triệu tấn, nhờ nhu cầu lương thực, thức ăn chăn nuôi và công nghiệp cao hơn.
FAO cũng dự báo thương mại ngũ cốc thế giới sẽ tăng 2,3% lên 420 triệu tấn trong năm 2019 - 2020, mức lơn thứ hai được ghi nhận, với xuất khẩu lúa mì chiếm hơn một nửa mức tăng dự kiến.
Theo Kinh tế & Tiêu dùng",Báo cáo mới nhất của Tổ chức Lương thực và Nông nghiệp Liên Hợp Quốc (FAO) cho biết giá thực phẩm trên thế giới giảm trong tháng 2 sau 4 tháng tháng liên tiếp vì giá dầu thực vật xuất khẩu giảm mạnh khi virus corona bùng phát dấy lên lo ngại nhu cầu sẽ chậm lại.
1,"VIRUS CORONA BÙNG PHÁT TẠI IRAN, XUẤT KHẨU GẠO BASMATI ẤN ĐỘ GẶP KHÓ",04 | 03 | 2020,"Đất nước Tây Á này là một trong những thị trường xuất khẩu gạo basmati lớn nhất của Ấn Độ. Khởi đầu niên vụ 2019-20 với kì vọng sản lượng lúa cao, đạt hơn 117 triệu tấn cộng với triển vọng xuất khẩu yếu, các nhà xuất khẩu gạo Ấn Độ đang hứng chịu thua lỗ lớn. Sản lượng lúa niên vụ 2019/20 cao hơn 9,67 triệu tấn so với mức trung bình 5 năm, ở mức 107,8 triệu tấn.
Xuất khẩu tăng trưởng kép hàng năm gần 14%/năm trong giai đoạn 2010 – 2019, chịu thiệt hại nặng nề bởi các vấn đề địa chính trị tiêu cực, các quy tắc thương mại thắt chặt và chính phủ tăng giá thu mua tối thiểu (MSP). Diễn biến thị trường bất lợi đang dẫn tới xu hướng giá gạo basmati giảm. Trên sàn giao dịch hàng hóa ICEX, giá gạo basmati pusa giao dịch ở mức 3.030 Rupee/tạ, giảm giá do sự lây lan của virus corona. Tuy nhiên, giá lúa trên thị trường giao ngay cũng liên tục giảm.
Sau khi bùng phát dịch bệnh, Iran đã ngừng các đơn hàng nhập khẩu gạo basmati Ấn Độ, dẫn tới xuất khẩu gạo basmati giảm 18 – 20$ so với cùng kỳ năm 2019. Iran và phần còn lại của tây Á chiếm tỷ trọng lớn nhất trong cơ cấu xuất khẩu gạo basmati, chiếm hơn 30% tổng kim ngạch.
Đồng giám đốc điều hành của Kohinoor Foods Gurnam Arora cho hay: “Virus corona đang là nỗi lo lắng lớn nhất cho các nhà xuất khẩu và với tình hình hiện nay tại Iran, tình hình chỉ ngày càng trầm trọng hơn. Tác động của bùng phát dịch bệnh đã bắt đầu hiển lộ trong thương mại và du lịch quốc tế”.
Ông cho biết thêm các nhà xuất khẩu đang áp dụng chiến lược chờ đợi và quan sát tình hình trong 4 – 6 tuần tới. Đồng thời, nhà giao dịch gạo có trụ sở tại Mumbai là Devendra Vora bi quan về triển vọng ngành trong ngắn hạn, cho biết không có dấu hiệu tích cực. “Thị trường tiếp tục suy yếu do nhiều nguyên nhân và chúng tôi chỉ có thể hy vọng tình hình sẽ cải thiện trong 1 – 2 tháng tới”, ông cho hay. Trước đó, ông đã khuyến nghị chính phủ nên thúc đẩy xuất khẩu nông sản sang Brazil – một thị trường tiêu thụ gạo và lúa mỳ lớn, để phần nào giảm thiểu khó khăn cho các nhà xuất khẩu Ấn Độ.
Xuất khẩu gạo, đặc biệt là gạo basmati sang Iran, đạt 1,5 tỷ USD trong năm tài khóa 2018/19. Theo báo cáo của công ty thương mại tài chính có trụ sở tại Mỹ Drip Capital, xuất khẩu gạo giảm trên thị trường toàn cầu, với suy giảm tập trung tại Tây Á do các căng thẳng địa chính trị. Ấn Độ hiện là nước xuất khẩu gạo lớn nhất thế giới, chiếm thị phần 25% trên thị trường toàn cầu nhưng gạo chỉ đóng góp 2% trong tổng kim ngạch xuất khẩu của nước này.
Theo Business Standard",Xuất khẩu gạo từ Ấn Độ – vốn đã chịu tác động nặng nề bởi căng thửng giữa Mỹ và Iran – đang đối diện với khó khăn mới khi virus corona bùng phát tại Iran và nước này đã báo một vài người chết do dịch bệnh.
1,BẢN TIN THỊ TRƯỜNG GẠO TUẦN 10/2020: TRUNG QUỐC TỰ TIN CÓ THỂ HOÀN THÀNH MỤC TIÊU SẢN LƯỢNG GẠO 2020,09 | 03 | 2020,"Ngày 5/3, ông Pan Wenbo - Giám đốc Cục Quản lí Cây trồng thuộc Bộ Nông nghiệp và Nông thôn Trung Quốc, hơn một nửa diện tích lúa của Trung Quốc hiện được gieo trồng trong vụ xuân.
Tuy nhiên, ông Pan nhận định các khó khăn trong công cuộc đẩy lùi dịch virus corona (COVID-19) có thể là trở ngại cho quá trình gieo trồng lúa.
Tỉnh Hồ Bắc (một vùng canh tác lúa quan trọng của Trung Quốc) cùng tâm dịch Vũ Hán là hai nơi phải chịu thiệt hại nghiêm trọng nhất, ông Zhang Yanqiu - Giám đốc Cục Quản lí Hạt giống của Bộ Nông nghiệp và Nông thôn Trung Quốc, cho hay.
Theo Reuters, Bộ này đang nỗ lực để có thể cung cấp thêm nguồn cung hạt giống cho nông dân tại Hồ Bắc. Bên cạnh hạt giống, nông dân Hồ Bắc còn phải đối mặt với tình trạng thiếu hụt các sản phẩm đầu vào quan trọng khác như phân bón.
""Nếu chúng tôi có thể giải quyết vấn đề của tỉnh Hồ Bắc, vấn đề của Trung Quốc cũng từ đó mà được gỡ rối"", ông Zhang chia sẻ.
Theo ông Zhang, bất chấp ảnh hưởng của dịch COVID-19, Trung Quốc tự tin có thể hoàn thành mục tiêu về sản lượng gạo năm 2020. Các nhà sản xuất phân bón của Trung Quốc đang hoạt động với hơn 60% công suất.
Dù vấp phải khó khăn, ông Pan của Cục Quản lí Cây trồng cho hay tiến độ gieo trồng lúa trên toàn Trung Quốc có thể tương đương với các năm khác, đồng thời ông nói thêm rằng ông tin tưởng Trung Quốc có thể hoàn thành mục tiêu về sản lượng gạo năm nay.
Ông Pan cũng nhấn mạnh, vụ xuân năm nay sẽ là một chỉ số đánh giá quan trọng đối với các quan chức Trung Quốc trong năm 2020.
Ngoài ra, ông cho hay việc kho dự trữ gạo quốc gia thu mua gạo với giá cao hơn trong năm 2020 cũng có thể phát đi tín hiệu mới, khuyến khích nông dân tăng thêm sản lượng.
""Để đảm bảo an ninh lương thực, sản lượng gạo phải ổn định trở lại và đặc biệt là diện tích gieo trồng lúa hai vụ/năm không thể tiếp tục giảm"", ông Pan nhấn mạnh.
Trong khi đó, tại Thái Lan, dịch virus corona lại góp phần giúp giá gạo nước này có thể đạt đỉnh vào giữa năm nay.
Ông Chookiat Ophaswongse - Chủ tịch danh dự của Hiệp hội các nhà xuất khẩu gạo Thái Lan, cho hay nhu cầu gạo trên toàn cầu đã tăng lên do dịch virus corona (COVID-19) bùng phát. Giá gạo cũng nhờ đó mà tăng tới 30 - 50 USD so với đầu năm nay.
""Người dân trên khắp thế giới, mà đặc biệt là ở Mỹ, châu Âu và châu Á, đang phải ở yên trong nhà. Trong khi đó, Trung Quốc - nước kiểm soát lượng gạo lên đến 120 triệu tấn, đã tạm dừng xuất khẩu sau khi xuất đi 3 triệu tấn gạo với giá thấp hơn giá gạo Thái Lan khoảng 100 USD/tấn hồi năm ngoái"", ông Ophaswongse nói.
Trước khi dịch virus corona bùng phát, các chuyên gia dự đoán Trung Quốc có thể tăng kim ngạch xuất khẩu gạo lên 3,5 - 4 triệu tấn trong năm nay.
Tại Myanmar, thông tin từ Cục chế biến và phát triển thị trường nông sản (Bộ Công Thương) cho biết trong 5 tháng đầu tiên của năm tài khóa 2019-2020, Myanmar đã xuất khẩu trên 1,19 triệu tấn gạo và tấm.
Đây là số liệu mới nhất vừa được Liên đoàn gạo quốc gia Myanmar công bố ngày 29/2. Lượng gạo xuất khẩu này được thực hiện từ ngày 1/10/2019 đến ngày 7/2/2020.
""Thương nhân từ nhiều nước hiện nay quan tâm đến gạo Thái Lan hơn, họ sẵn sàng mua lượng lớn để tăng dự trữ gạo của mình"", vị Chủ tịch này cho hay.
""Giá gạo trắng 5% giao lên tàu đã tăng từ 400 USD/tấn hồi đầu năm  lên 440 - 450 USD/tấn"", ông nói thêm.
Ông Chookiat Ophaswongse lí giải: ""Vài năm qua, thương nhân gặp khó trong việc bán gạo Thái Lan do giá tương đối cao so với sản phẩm của các nước khác.
Theo Kinh tế & Tiêu dùng","Tuần qua, các quan chức Bộ Nông Nghiệp và Nông thôn Trung Quốc cho hay nước này có thể hoàn thành mục tiêu về sản lượng gạo trong năm nay, bất chấp sự bùng phát của dịch virus corona."
1,GIÁ GẠO DỰ BÁO TĂNG LIÊN TỤC TỚI GIỮA NĂM 2020,10 | 03 | 2020,"Chookiat Ophaswongse, chủ tịch danh dự của Hiệp hội, cho rằng nhu cầu gạo toàn cầu tăng vọt kể từ khi bùng phát virus corona, dẫn tới giá gạo tăng tới 30 – 50 USD/tấn trong thời gian đầu năm 2020. “Người dân, đặc biệt là tại Mỹ, châu Âu và châu Á, đang tập trung ở nhà, trong khi tại Trung Quốc – đất nước có tồn kho gạo khổng lồ lên tới 120 triệu tấn – cũng phải giảm xuất khẩu sau khi đẩy mạnh xuất khẩu tới 3 triệu tấn gạo ở mức giá thấp hơn giá gạo Thái Lan 100 USD/tấn trong năm 2019”.
Trước khi virus bùng phát, Trung Quốc được cho là sẽ xuất khẩu 3,5 – 4 triệu tấn gạo trong năm 2020. “Người mua từ một vài nước đang bắt đầu quan tâm tới gạo Thái, và một số nhà nhập khẩu thậm chí sẵn sàng mua lượng không hạn chế để tăng cường tích trữ”, theo nhân vật kì cựu ngành gạo Thái Lan này cho hay. “Giá gạo 5% tấm FOB tăng từ 400 USD/tấn hồi đàu năm lên 440 – 450 USD/tấn hiện nay. “Một vài nhà giao dịch gặp khó khăn trong việc bán gạo Thái những năm gần đây do gạo Thái có giá cao hơn so với các đối thủ cạnh tranh khác”, ông cho biết. “Một khi Trung Quốc bắt đầu giảm xuất khẩu, đồng Baht yếu đi, và Indonesia có thể bắt đầu tăng cường nhập khẩu, triển vọng thương mại gạo sẽ sáng lạn hơn”, ông Chookiat dự báo giá gạo sẽ tăng dần từ nay tới giữa năm hoặc cho tới khi đại dịch này lắng xuống.
Trong một diễn biến khác, Hội đồng Chính sách ngành gạo quốc gia đã phê duyệt một cơ chế bảo hiểm gạo cho niên vụ 2020, trị giá 2,91 tỷ Baht, tương đương 92,5 triệu USD để cho 7,152 triệu ha đất nông nghiệp. Narumon Pinyosinwat, người phát ngon văn phòng chính phủ cho biết cơ chế bảo hiểm lúa gạo sẽ được triển khai dưới 2 dạng – 1 chương trình bảo hiểm cơ bản (lớp 1) và một chương trình bảo hiểm tự nguyện (lớp 2).
Chương trình bảo hiểm cơ bản sẽ dành cho các khách hàng của Ngân hàng Nông nghiệp và Hợp tác Nông nghiệp (BAAC) và những nông dân tại các khu vực rủi ro thấp, với mức phí bảo hiểm lần lượt là 97 Baht/rai và   58 Baht/rai. Mức phí bảo hiểm cho nông dân tại khu vực rủi ro ở mức 210 Baht/rai và chính phủ sẽ trợ cấp 73,77 Baht/rai. Theo cơ chế này, nông dân sẽ nhận bồi thường 1.260 Baht/rai đối với lúa gạo chịu thiệt hại bởi thảm họa tự nhiên. Họ có thể bảo đảm thêm cho thiệt hại gây ra bởi dịch bệnh trên cây trồng với mức phí 630 Baht/rai.
Cơ chế bảo hiểm tự nguyện sẽ áp dụng cho các khách hàng muốn mua thêm bảo hiểm và nông dân phổ thông. Các mức phí bảo hiểm sẽ là 24 Baht/rai đối với nông dân tại vùng rủi ro thấp, 48 Baht/rai đối với nông dân vùng rủi trung bình và 101 Baht/rai với nông dân vùng rủi ro cao. Nông dân sẽ nhận bồi thường 240 Baht/rai với thảm họa tự nhiên và 120 Baht/rai với thiệt hại gây ra bởi dịch bệnh trên cây trồng. Chính phủ sẽ không áp dụng bất cứ khoản trợ cấp nào cho bảo hiểm tự nguyện.
Theo Bangkok Post","Giá gạo dự báo tăng tới giữa năm do người tiêu dùng toàn cầu đang tăng mạnh tích trữ, đồng thời Trung Quốc khó có thể tiếp tục nhịp độ xuất khẩu gạo như năm 2019 do an toàn thực phẩm trở nên sống còn giữa đại dịch Covid-19."
1,CHÍNH PHỦ TRUNG QUỐC QUYẾT TÂM ĐẠT ỔN ĐỊNH NGUỒN CUNG NGŨ CỐC GIỮA BÃO DỊCH CÚM,05 | 03 | 2020,"Theo tuyên bố từ nhóm tác chiến của chính phủ Trung Quốc, nước này không được phép để sản lượng ngũ cốc giảm trong năm 2020, giữa những mối lo chồng chất về kìm chế sự lây lan của virus corona có thể tổn hại cho an nình lương thực tại quốc gia đông dân nhất thế giới này.
Vài tuần sau khi bắt đầu xuống giống vụ xuân, nhóm tác chiến của chính phủ về vấn đề virus corona đã yêu cầu các tỉnh thành điều động nông dân và đảm bảo các diện tích đã xuống giống cùng sản lượng ngũ cốc phải duy trì ổn định. Việc cấm người dân di chuyển làm tăng nỗi lo rằng nông dân không thể canh tác trên đồng ruộng và chăm sóc cây trồng. Tỉnh Hồ Bắc, trung tâm của nạn dịch bị phong tỏa gắt gao, có sản lượng gạo chiếm 9% tổng sản lượng gạo của Trung Quốc trong năm 2019.
Trong tuyên bố trên website của chính phủ, nhóm tác chiến cho biết những vùng có điều kiện trồng trọt tốt nên khôi phục lại sản xuất lúa gạo hai vụ, đảo ngược chính sách trong những ngăm gần đây về giảm vụ, tập trung vào chất lượng thay vì sản lượng. Ngoài ra, nông dân được khuyến nghị mở rộng diện tích canh tác lúa vụ sớm và giảm diện tích đất bỏ hoang. Nhóm tác chiến cũng kêu gọi các nhà chức trách hỗ trợ nông dân đối mặt tới tình trạng thiếu lao động để tránh rủi ro đất nông nghiệp không được sử dụng hiệu quả.
Theo Reuters",Chính phủ Trung Quốc quyết tâm đạt ổn định nguồn cung ngũ cốc giữa bão dịch cúm
