category,title,date,content,brief
1,"THỦ TƯỚNG: XUẤT KHẨU GẠO PHẢI XEM XÉT KĨ LƯỠNG, THẬN TRỌNG",04 | 04 | 2020,"Văn phòng Chính phủ vừa ban hành văn bản 140/TB-VPCP thông báo kết luận của Thủ tướng Chính phủ Nguyễn Xuân Phúc tại cuộc họp Thường trực Chính phủ về việc xuất khẩu gạo trong bối cảnh dịch bệnh và hạn hán, xâm nhập mặn.
Thủ tướng nêu rõ bảo đảm an ninh lương thực là vấn đề chiến lược, trọng đại liên quan đến đời sống nhân dân, an ninh, quốc phòng.
Hiện nay, tình hình dịch bệnh COVID-19 và thời tiết, biến đổi khí hậu đang diễn ra hết sức phức tạp, khó lường; dự báo ảnh hưởng không nhỏ đến sản xuất nông nghiệp và nguồn cung lúa gạo trong nước; một số quốc gia và vùng lãnh thổ đã phong tỏa và tăng cường dự trữ lương thực...
Do đó, việc xuất khẩu gạo trong bối cảnh hiện nay cần xem xét kĩ lưỡng, thận trọng; trước hết phải bảo đảm an ninh lương thực quốc gia, đồng thời giảm thiểu việc gián đoạn chuỗi sản xuất lúa gạo, bảo vệ quyền lợi hợp pháp, chính đáng cho người nông dân và các tổ chức kinh doanh có liên quan.
Thủ tướng Chính phủ yêu cầu Bộ Nông nghiệp và Phát triển nông thôn chủ trì, phối hợp với Ủy ban nhân dân các tỉnh, thành phố trực thuộc Trung ương và các cơ quan liên quan đẩy mạnh sản xuất nông nghiệp trên các vùng miền, đặc biệt ở những nơi có tiềm năng, lợi thế, bảo đảm đủ nhu cầu lương thực trong nước và một phần phù hợp cho xuất khẩu.
Bộ Công Thương chủ trì, phối hợp với các cơ quan liên quan tăng cường kiểm tra, xử lí nghiêm các trường hợp đầu cơ găm hàng, gây khan hiếm giả tạo nhằm thao túng giá đối với mặt hàng gạo.
Thủ tướng giao Bộ Công Thương lấy ý kiến các Bộ Tài chính, Nông nghiệp và Phát triển nông thôn và các cơ quan liên quan về việc xuất khẩu gạo trong bối cảnh hiện nay; yêu cầu các Bộ Nông nghiệp và Phát triên nông thôn, Tài chính và các cơ quan liên quan có ý kiến chính thức bằng văn bản gửi Bộ Công Thương trước ngày 5/4.
Trên cơ sở đó, Bộ trưởng Bộ Công Thương hoàn thiện phương án đề xuất, kí văn bản báo cáo Thủ tướng Chính phủ trước ngày 6/4, bảo đảm nguyên tắc đáp ứng đầy đủ nhu cầu tiêu dùng gạo trong nước trong mọi tình huống, tuyệt đối không để xảy ra thiếu gạo, nhất là trong bối cảnh biến đổi khí hậu và tình hình dịch COVID-19.
Bộ Tài chính khẩn trương mua đủ số lượng lương thực dự trữ theo chỉ tiêu, kế hoạch dự trữ quốc gia năm 2020 đã được Thủ tướng Chính phủ phê duyệt để đáp ứng kịp thời các yêu cầu đột xuất, cấp bách; nghiên cứu việc mua tăng thêm mức dự trữ nếu cần thiết.
Theo Kinh tế & Tiêu dùng
 ","Việc xuất khẩu gạo trong bối cảnh hiện nay cần xem xét kĩ lưỡng, thận trọng; trước hết phải bảo đảm an ninh lương thực quốc gia, đồng thời giảm thiểu việc gián đoạn chuỗi sản xuất lúa gạo."
1,"GIÁ GẠO THÁI LAN LÊN CAO NHẤT 7 NĂM KHI DỊCH COVID-19 HẠN CHẾ THƯƠNG MẠI TỪ VIỆT NAM, ẤN ĐỘ",04 | 04 | 2020,"Theo Reuters, giá gạo trằng 5% tấm của Thái Lan được ghi nhận trong khoảng 560 - 570 USD/tấn trong ngày 2/4, mức cao nhất kể từ tháng 4/2013.
""Tình hình tại Việt Nam, Ấn Độ và Campuchia đã khiến chúng tôi chuẩn bị cho những điều bất thường, vì vậy giá gạo Thái Lan đang tăng từng ngày. Hiện tại mọi người sẽ mua gạo ở đâu nếu không phải từ Thái Lan?"", một thương nhân có trụ sở tại Bangkok cho biết.
Đầu tuần này, Campuchia cũng cho biết sẽ cấm xuất khẩu gạo trắng và thóc để đảm bảo an ninh lương thực địa phương trong đại dịch COVID-19.
Tuy nhiên ngay cả khi các nhà xuất khẩu và thương nhân Thái Lan dự đoán nhu cầu tăng cao, họ vẫn lo ngại giá cao hơn có thể khiến khách hàng thường xuyên không muốn giao dịch.
Giá gạo xuất khẩu củaThái Lan đã tăng từ mức 468 - 495 USD/tấn trong tuần trước nhờ dự báo Philippines có thể phải nhập khẩu một lượng gạo từ Thái Lan để đạt mục tiêu 300.000 tấn được công bố hôm thứ Ba (31/3), các thương nhân cho biết.
Tuy nhiên, hôm 2/4, người mua gạo hàng đầu thế giới, Philippines, cho biết đã có cam kết đảm bảo cung cấp liên tục gạo từ Việt Nam.
Thông báo được đưa ra ngay cả khi Việt Nam cấm kí hợp đồng xuất khẩu mới theo đánh giá để đảm bảo đủ nguồn cung nội địa trong thời gian virus corona chủng mới bùng phát.
""Chúng tôi vẫn đang chờ quyết định cuối cùng từ Thủ tướng nhằm dỡ bỏ lệnh cấm để chúng tôi có thể tiếp tục xuất khẩu gạo vì nguồn cung trong nước rất dồi dào"", một thương nhân có trụ sở tại TP HCM chia sẻ.
Giá gạo 5% tấm của Việt Nam không được công bố tuần thứ hai liên tiếp.
Trong khi đó, Bangladesh sẽ bắt đầu bán gạo giảm giá từ tuần tới để giúp đỡ người nghèo khi giá gạo trong nước lên cao nhất trong hai năm vì tình trạng mua hoảng loạn dưới ảnh hưởng của dịch bệnh.
Hàng triệu người không có điều kiện đang trong tình trạng khó khăn khi quốc gia Nam Á kéo dài thời gian đóng cửa cả nước tới ngày 11/4 để ngăn chặn sự lây lan của virus corona.
Các nhà xuất khẩu gạo Ấn Độ đã không báo giá trong tuần này sau khi Thủ tướng Narendra Modi áp lệnh đóng cửa toàn quốc trong 21 ngày bắt đầu từ ngày 24/3 để bảo vệ 1,3 tỉ người dân khỏi sự lây lan nhanh chóng của virus.
Tuần trước, giá gạo đồ 5% tấm của nhà xuất khẩu hàng đầu gạo hàng đầu thế giới ghi nhận trong khoảng 361 - 365 USD/tấn, mức thấp nhất trong ba tháng.
Các nhà xuất khẩu đã không hoạt động trong tuần này vì lệnh đóng cửa cả nước, một nhà xuất khẩu có trụ sở tại Mumbai cho hay.
Theo Kinh tế & Tiêu dùng","Tuần này, giá xuất khẩu gạo Thái Lan tăng vọt lên cao nhất trong 7 năm nhờ kì vọng doanh số bán tăng sau khi nhà xuất khẩu hàng đầu Ấn Độ bước vào giai đoạn đóng cửa để ngăn chặn sự lây lan của virus corona và đối thủ chính Việt Nam tạm ngừng kí hợp đồng xuất khẩu mới."
1,"LÃNH ĐẠO CÁC TỈNH ĐBSCL: VỤ ĐÔNG XUÂN 2020 ĐƯỢC MÙA, DƯ LÚA GẠO",27 | 03 | 2020,"Ông Mai Anh Nhịn - Phó Chủ tịch UBND tỉnh Kiên Giang: Giá thấp, dân ngại xuống giống
Mặc dù vụ đông xuân trên địa bàn tỉnh gặp nhiều khó khăn do xâm nhập mặn nhưng nhờ triển khai tốt các giải pháp ứng phó, nông dân đã có một vụ đông xuân được mùa được giá.
Để làm được điều đó chúng tôi đã xây dựng 195 đập ngăn mặn để bảo vệ diện tích lúa đông xuân.
Theo thống kê, diện tích lúa đông xuân của tỉnh Kiên Giang đạt 289.837ha, vượt 743 ha so với kế hoạch đặt ra. Đến nay, chúng tôi đã thu hoạch được 93% diện tích, năng suất bình quân 7,24 tấn/ha,  tổng sản lượng đạt 1,924 triệu tấn; tăng 0,3 tấn/ha về năng suất và 104.712 tấn về sản lượng so với vụ đông xuân 2018 - 2019.
Trong cơ cấu giống lúa của tỉnh, các loại giống chất lượng cao chiếm 93,65%, diện tích sử dụng giống xác nhận các cấp tương đương khoảng 76,46%.
Chúng tôi cũng đã liên kết xây dựng 34 cánh đồng lớn, có 19.000ha có sự tham gia của doanh nghiệp trong tiêu thụ lúa gạo.
Kế hoạch vụ hè thu, chúng tôi dự kiến xuống giống 284.000ha, hiện đã gieo được 58.000ha; vụ thu đông dự kiến xuống giống 72.000ha.
Tuy nhiên, để khuyến khích nông dân tiếp tục xuống giống lúa trong các vụ tiếp theo, chúng tôi kiến nghị Bộ Công Thương, Bộ NNPTNT đề xuất Thủ tướng xem xét lại vấn đề tạm dừng xuất khẩu gạo.
Sau khi Thủ tướng có quyết dịnh tạm ngừng xuất khẩu gạo, chúng tôi cũng đã trao đổi với doanh nghiệp, hiện giá lúa trong dân đã giảm hơn trước 300 – 500 đồng/kg, nếu tạm dừng xuất khẩu gạo sẽ ảnh hưởng đến sản xuất của người dân, giá thấp người dân  sẽ không xuống giống vụ thu đông nữa.
Ông Nguyễn Thanh Tuyền, Giám đốc Sở NNPTNT tỉnh Long An: Long An chủ yếu xuất khẩu nếp sang Trung Quốc
Dù hạn mặn ảnh hưởng nghiêm trọng hơn vụ đông xuân 2015 - 2016 nhưng vụ đông xuân của tỉnh Long An vẫn đạt được nhiều thắng lợi, chỉ thiệt hại khoảng 4.800ha, trong đó có 890ha mất trắng, tỷ lệ thiệt hại khoảng 2,1% diện tích.
Năng suất lúa khá cao, 60,4 tạ/ha, tăng 1,2 tạ/ha so với vụ đông xuân 2018- 2019, chính vì vậy, vụ đông xuân 2019 - 2020 dù diện tích giảm hơn 4.000ha những sản lượng chung chỉ giảm 10.000 tấn. Đặc biệt, giá lúa ổn định, giúp nong dân có lãi trên 30%.
Vụ hè thu, tỉnh Long An dự kiến xuống giống 217.640ha, hiện đã xuống giống 34.000ha vùng Đồng Tháp Mười.
Một vấn đề đang khiến nhiều doanh nghiệp lo lắng là chủ trương tạm dừng xuất khẩu gạo của Chính phủ. Qua làm việc với các doanh nghiệp, chúng tôi được biết, tồn kho của các doanh nghiệp trên địa bàn khoảng 300.000 tấn, có 24 doanh nghiệp tham gia xuất khẩu gạo.
Hiện, một số doanh nghiệp kiến nghị với những hợp đồng ký trước 24/3 vẫn tiếp tục cho xuất khẩu, bởi các doanh nghiệp của Long An chủ yếu xuất khẩu nếp sang Trung Quốc, nếu dừng lại sẽ thiệt hại lớn.
Theo Dân Việt
 ","Về chủ trương tạm dừng xuất khẩu gạo, tại Hội nghị trực tuyến sơ kết sản xuất trồng trọt vụ đông xuân 2019 - 2020 triển khai kế hoạch vụ hè thu, thu đông, mùa năm 2020 tại các tỉnh, thành Nam Bộ, đại diện nhiều địa phương kiến nghị, Bộ Công Thương, Bộ NNPTNT đề xuất với Chính phủ xem xét lại chủ trương này."
1,XUẤT KHẨU GẠO ẤN ĐỘ GIẢM 35%,27 | 03 | 2020,"Hiện rất nhiều lô hàng gạo Basmati xuất khẩu của nước này đang bị mắc kẹt tại các cảng biển không đến được quốc gia nhập khẩu do vướng các thủ tục kiểm dịch thực vật cũng như quy định vận hành thời điểm dịch bệnh. Ngoài ra chi phí vận chuyển, kho bãi cũng như nhân công khan hiếm đã đánh thẳng vào doanh số khiến nhiều nhà xuất khẩu méo mặt.
Ước tính, trong ba tháng đầu năm 2020, lượng gạo xuất khẩu của nước này có thể sụt giảm tới 35% so với cùng kỳ năm ngoái.
Hiện lệnh phong tỏa toàn bộ đất nước 1,3 tỷ người bắt đầu từ giữa tuần này vì coronavirus của Thủ tướng Narendra Modi cũng đồng nghĩa với việc các nhà máy xay sát, chế biến gạo xuất khẩu trên cả nước ngưng hoạt động, bất chấp nhu cầu lương thực đang tăng cao tại nhiều quốc gia.
Lệnh giới nghiêm với dân chúng nhưng mặt khác chính phủ vẫn yêu cầu một số doanh nghiệp lớn như LT Foods vẫn buộc phải phân công lao động hợp lý để hoạt động, nhằm đảm bảo an ninh lương thực.  Giám đốc điều hành LT Fooods, Ashwani Kumar Arora cho biết, do mặt hàng gạo Basmati được xếp vào diện hàng thiết yếu nên đơn vị này đang gặp nhiều áp lực trong việc tìm kiếm công nhân để duy trì hoạt động do chuỗi cung ứng đã bị đứt gãy.
“Rất khó để vận hành dây chuyền sản xuất trong thời điểm này, bởi các quy định chồng chéo như công nhân mỗi kíp không được quá 5 người hay lệnh giãn cách cộng đồng cũng có nguy cơ đẩy các nhà kho trữ gạo đối mặt nạn cướp bóc do quá ít lực lượng bảo vệ”, ông Sanjay Gupta, giám đốc tập đoàn lương thực Karnal trụ sở ở Bharat nói.
Theo cựu Chủ tịch Hiệp hội các nhà xuất khẩu gạo Ấn Độ, Vijay Sethia, hiện có hàng chục ngàn tấn gạo đang bị mắc kẹt trên đường xuất khẩu do ảnh hưởng bởi dịch Covid-19. “Trung bình mỗi tháng các doanh nghiệp xuất đi các nước khoảng 400.000 tấn nhưng kể từ khi dịch bệnh bùng phát đã bị sụt giảm nghiêm trọng”, ông Sethia nói.
Nguồn: (EconomicTimes)","Các doanh nghiệp hàng đầu tại quốc gia xuất khẩu gạo lớn nhất thế giới đang đau đầu vì đại dịch Covid-19 khiến hàng hóa bị đình trệ, đẩy các loại thuế phí lên cao."
1,"THỦ TƯỚNG: SẼ GIỮ 3,5 TRIỆU HA ĐẤT ĐỂ TRỒNG LÚA",20 | 03 | 2020,"Thủ tướng Nguyễn Xuân Phúc nhấn mạnh điều này khi kết luận Hội nghị trực tuyến toàn quốc tổng kết 10 năm thực hiện Kết luận 53 của Bộ Chính trị về Đề án “An ninh lương thực quốc gia đến năm 2020” vào sáng 18/3 tại Hà Nội.
Đánh giá về kết quả đã đạt được trong Đề án bảo đảm an ninh lương thực, Thủ tướng cho rằng: Với những thành quả về nông nghiệp, bảo đảm an ninh lương thực mà chúng ta đã đạt được trong 10 năm qua, không chỉ căn bản đáp ứng nhu cầu của nhân dân mà còn phục vụ xuất khẩu. Trong hoàn cảnh biến động, thiên tai, dịch bệnh nhưng chúng ta vẫn bảo đảm cho cân đối sản phẩm nông nghiệp.
“Một năm mình có bao nhiêu cơn bão, cơn lũ nhưng lương thực vẫn đạt bốn mấy triệu tấn trở lên. Đi đôi với tăng cường năng lực sản xuất, chúng ta đã chú ý thích đáng đến phát triển bền vững, an sinh xã hội, với tinh thần ""quan tâm đến toàn xã hội, không để ai bị bỏ lại phía sau, không để ai bị đứt bữa”, người đứng đầu Chính phủ khẳng định.
Lấy ví dụ về phòng chống dịch Covid-19, Thủ tướng cho biết, chúng ta chăm sóc công dân Việt Nam, quan tâm cả người nước ngoài, xử lý vấn đề nhân văn, “chứ không phải chạy theo đồng tiền”. Trong nông nghiệp nông thôn và an ninh lương thực cũng như vậy, hằng năm, Chính phủ cấp phát miễn phí hơn 200.000 tấn gạo.
Bên cạnh đó, Thủ tướng chỉ ra một số tồn tại, bất cập cần khắc phục như liên kết sản xuất chuỗi gắn với vùng sản xuất, chế biến, tổ chức thị trường nhìn chung trên tất cả các ngành hàng còn yếu. Năng suất lao động trong nông nghiệp còn thấp do sản xuất quy mô nhỏ, manh mún. Ứng dụng cơ giới hóa, tự động hóa đạt tỉ lệ thấp, làm cho giá thành cao, khó cạnh tranh.
Nhắc đến ý kiến, kiến nghị Chính phủ xem xét, nắm giữ một tỉ lệ cổ phần hợp lý khi cổ phần hóa để bảo đảm vai trò điều tiết, bình ổn khi cần thiết của lãnh đạo Vinafood1 (Tổng Công ty Lương thực miền Bắc) tại hội nghị, Thủ tướng cho rằng, quan điểm cổ phần hóa doanh nghiệp nhà nước là đúng để huy động các nguồn lực, nâng cao hiệu quả hoạt động nhưng các khâu quan trọng, Nhà nước vẫn phải nắm để điều hành nền kinh tế thị trường định hướng xã hội chủ nghĩa. Huy động nguồn lực toàn xã hội nhưng những “quả đấm then chốt” Nhà nước phải nắm để nâng cao năng lực ứng phó khi có biến động.
Nêu định hướng thời gian tới, Thủ tướng cho rằng, an ninh lương thực càng trở nên bức thiết hơn khi dân số có xu hướng tăng, gần 900 triệu người trên toàn cầu đang thiếu đói, thiên tai, biến đổi khí hậu diễn ra mạnh mẽ, tốc độ đô thị hóa cao, dịch bệnh bất thường.
“Thử thách rất lớn. Nếu không xác định sự bức thiết về an ninh lương thực trong giai đoạn tới thì sai lầm trong chỉ đạo. Chúng ta làm sao phải bảo đảm an ninh lương thực một cách vững chắc trong mọi tình huống”, Thủ tướng nêu rõ.
Theo Thủ tướng, phải chốt cứng diện tích trồng lúa và sản lượng lương thực hằng năm và tăng cường khả năng dự trữ. Không chạy theo thị trường và nêu cao tinh thần tự cường, chủ động đối với an ninh lương thực.
Chuyển nhận thức phát triển nông nghiệp từ vai trò an sinh, đủ ăn, điểm tựa cho sự phát triển thành vai trò mới, là một lợi thế đặc thù, có tính cạnh tranh cao trong phát triển kinh tế, hội nhập.
Nhấn mạnh về các nhiệm vụ, mục tiêu quan trọng trong thời gian tới, Thủ tướng Chính phủ cho hay: Sắp tới Việt Nam phải đáp ứng, thỏa mãn nhu cầu dinh dưỡng, cơ cấu thực phẩm hợp lý, khoa học trong từng giai đoạn, kể cả lượng và chất, ít nhất cho quy mô 104 triệu người vào năm 2030 để chống tình trạng thấp, bé, còi của người Việt Nam.
Tốc độ tăng trưởng xuất khẩu đạt 9-10%/năm, phấn đấu đến năm 2030, nông nghiệp đạt kim ngạch xuất khẩu 100 tỷ USD.
Về lúa gạo và diện tích đất lúa, Thủ tướng nêu rõ, gạo có vai trò quan trọng trong cơ cấu thực phẩm, cho nên sẽ trình Chính phủ, Bộ Chính trị việc giữ trên 3,5 triệu ha đất trồng lúa để ít nhất có 35-38 triệu tấn lúa, tương ứng 22 triệu tấn gạo trong cân đối.
Về thực phẩm, Thủ tướng lưu ý các bộ, ngành liên quan cần tăng nhanh sản lượng sữa từ 1 triệu tấn lên 3 triệu tấn đến năm 2030 vì đây là loại thực phẩm góp phần cải thiện sức khỏe, tầm vóc giống nòi. Chúng ta tăng nhanh sản lượng trứng, thịt đỏ, thịt gà, thủy sản, rau quả có lợi cho sức khỏe và phù hợp với cơ cấu dinh dưỡng. ""Và đặc biệt chúng ta cũng cần đưa ra lời khuyên giảm thịt lợn trong khẩu phần và cơ cấu sản xuất"", Thủ tướng khẳng định.
Thủ tướng yêu cầu, sau Hội nghị này, Bộ NNPTNT hoàn thiện văn bản, báo cáo Bộ Chính trị để ban hành, làm cơ sở cho việc triển khai thời gian tới và chủ trì xây dựng, trình Chính phủ ban hành Nghị quyết mới về an ninh lương thực (thay thế Nghị quyết số 63/NQ-CP).
Theo Dân Việt","Trong phòng chống dịch Covid-19, Thủ tướng Nguyễn Xuân Phúc cho biết, chúng ta chăm sóc công dân Việt Nam, quan tâm cả người nước ngoài, xử lý vấn đề nhân văn, “chứ không phải chạy theo đồng tiền”. Trong nông nghiệp nông thôn và an ninh lương thực cũng phải làm như vậy, để không ai bị bỏ lại phía sau, không để ai bị đứt bữa."
1,TẠM DỪNG XUẤT KHẨU GẠO TỪ 0H NGÀY 24/3,25 | 03 | 2020,"Đại diện Tổng cục Hải quan xác nhận, ngày 24/3, Tổng cục Hải quan đã có điện hỏa tốc gửi các Cục hải quan tỉnh, thành phố và một số đơn vị trực thuộc yêu cầu tạm dừng thông quan các lô hàng xuất khẩu gạo từ 0h ngày 24/3.
Điều này được Tồng cục Hải quan giải thích là ""thực hiện kết luận của Thủ tướng Chính phủ Nguyễn Xuân Phúc tại cuộc họp Thường trực Chính phủ về đảm bảo an ninh lương thực trong bối cảnh tác động của dịch Covid-19.
Cụ thể, Tổng cục Hải quan yêu cầu Cục hải quan các tỉnh, thành phố tạm dừng việc đăng ký, tiếp nhận và thông quan đối với các lô hàng gạo các loại xuất khẩu dưới mọi hình thức kể từ 0 giờ ngày 24/3.
Các Cục hải quan tỉnh, thành phố chỉ giải quyết thủ tục thông quan theo quy định đối với các lô hàng xuất khẩu đã đăng ký tờ khai hải quan trước 0 giờ ngày 24/3/2020.
Tổng cục Hải quan giao Cục quản lý rủi ro thiết lập tiêu chí đưa mặt hàng gạo các loại thuộc các phân nhóm HS: 1006.20, 1006.30 và 1006.40 vào diện cấm xuất khẩu.
Cục Hải quan các tỉnh, thành phố, Cục Điều tra chống buôn lậu phải chỉ đạo các đơn vị trực thuộc tăng cường công tác đấu tranh chống buôn lậu, vận chuyển trái phép mặt hàng gạo các loại qua biên giới và xử lý vi phạm theo quy định.
Cũng trong ngày 24/3, Bộ Tài chính đã có văn bản yêu cầu Tổng cục Dự trữ nhà nước khẩn trương mua đủ số lượng lương thực dự trữ theo kế hoạch được giao để đảm bảo đáp ứng các yêu cầu đột xuất, cấp bách. Đồng thời yêu cầu Tổng cục Hải quan tạm dừng thông quan các lô hàng xuất khẩu gạo như nêu ở trên.
Theo báo cáo của Bộ Công Thương gần đây, hai tháng đầu năm 2020, dịch viêm đường hô hấp cấp do chủng mới virus corona (Covid-19) diễn biến nhanh, phức tạp và nghiêm trọng. Bên cạnh tình hình phức tạp về thiên tai, dịch bệnh, diễn biến thương mại gạo toàn cầu tiếp tục có các diễn biến tác động không nhỏ tới hoạt động xuất nhập khẩu gạo của Việt Nam.
Tổng khối lượng gạo xuất khẩu hai tháng đầu năm ước đạt 895 nghìn tấn, giá trị 410 triệu USD, tăng 27% về khối lượng và tăng 32,6% về giá trị so với cùng kỳ năm 2019.
Trước đó, năm 2019 xuất khẩu gạo đạt 2,81 tỷ USD.
Theo Vietnamnet","Tổng cục Hải quan yêu cầu Cục hải quan các tỉnh, thành phố tạm dừng việc đăng ký, tiếp nhận và thông quan đối với các lô hàng gạo các loại xuất khẩu dưới mọi hình thức kể từ 0 giờ ngày 24/3/2020."
