category,title,date,content,brief
1,HÀNG NGHÌN HÉCTA LÚA NGUY CƠ MẤT TRẮNG VÌ HẠN MẶN,10 | 02 | 2020,"Bơm “nước mặn” cứu lúa
Giữa trưa nắng gay gắt, cha con ông Thạch Cường, 53 tuổi ở ấp Tân Quy A, xã Tân Hưng (Long Phú, Sóc Trăng) hối hả bơm nước từ sông vào ruộng để cứu lúa.
Ông Cường có 4,3 ha (trong đó đất thuê 2,3 ha) được 1,5 tháng tuổi đang chuẩn bị giai đoạn làm đòng, năm nay mặn xâm nhập sớm khiến đất nứt nẻ, không đủ nước cho lúa phát triển.
 “Xung quanh lúa người ta vàng hoe, nhiều người bỏ luôn, còn của em xanh hơn nên cố gắng cứu được chút nào hay chút đó”, anh Thạch Trường (con trai ông Cường) nói.
Tuy nhiên, anh Thạch Trường cho biết, nước bơm vào không phải nước ngọt mà là nước mặn hơn 2%o. “Giờ không biết làm sao. Đồng khô queo, ruộng nứt nẻ, còn dưới kênh cạn khô, phải bơm nước từ sông vào kênh rồi tiếp tục bơm lên ruộng.
Ngày bơm tốn gần 500.000 đồng tiền xăng, không bơm lúa chết tức tưởi, còn bơm thì tăng thêm chi phí mà không biết có được ăn không”, anh Trường nói.
Ông Thạch Cường dẫn phóng viên ra cánh đồng nứt nẻ của mình rồi chỉ tay vào hạt phân còn nguyên nằm trên nền đất. ""Phân rải nằm ì đó, không có nước để hoà tan thì lấy đâu lúa phát triển. Giờ ruộng nứt nẻ, bỏ thì tiếc, đất thuê tốn mấy chục triệu đồng đầu tư"", ông Cường than thở.
Ông Cường gắn bó với đồng ruộng mấy chục năm nay. Ông có hai người con nhưng đều đi làm thuê ở Bình Dương, giờ tuổi già nên trước tết ông gọi con trai là anh Trường về phụ giúp.
“Giờ không biết lấy tiền đâu trả phân bón, vật tư của đại lý. Tình hình này bám quê khó sống, nhiều người cũng đã bỏ xứ đi làm thuê"", ông Cường nói.
Cùng hoàn cảnh, ông Sơn Ngọc Thành ở ấp Tân Quy, xã Tân Hưng (Long Phú) có 1,5 ha, lúa được hơn 30 ngày tuổi cũng chào thua. ""Sáng lên ruộng định bơm nước vào cứu lúa nhưng ngậm thử nước mặn đắng, lúa làm sao chịu nổi.
Coi như mất trắng luôn rồi”, ông Thành lắc đầu ngao ngán rồi cho biết, năm 2016 mặn xâm nhập nhưng còn vớt vát chút đỉnh, năm nay mặn đến sớm hơn cả tháng, làm giống đài thơm chịu mặn nhưng cũng bó tay.
Cống ngăn mặn ở Sóc Trăng ẢNH: HÒA HỘI
Ông Lâm Văn Vũ, Trưởng phòng NN&PTNT huyện Long Phú cho biết, năm nay mặn sớm hơn 1 tháng và cao hơn rất nhiều so mùa khô trung bình nhiều năm.
Từ đầu tháng 12/2019 đến nay nồng độ duy trì ở mức cao, hiện các kênh đã khô cạn nước, độ mặn ngày 6/2 là trên 6%o đã ảnh hưởng đến sản xuất. Cụ thể, hơn 3.600 ha lúa đông xuân muộn đang thiếu nước nghiêm trọng và gần như mất trắng.
Hàng nghìn héc ta lúa nguy cơ mất trắng
Tại Bạc Liêu, nông dân ở vùng ngọt ổn định của huyện Phước Long đã xuống giống gần 14.000ha lúa đông xuân.
Tuy nhiên, hiện nay hầu hết các kênh nội đồng trên địa bàn huyện đã bị cạn, dự báo khoảng 2.200 ha lúa đông xuân có nguy cơ thiếu nước trong những ngày tới. Mực nước tại các kênh, rạch ở vùng bắc quốc lộ 1A của tỉnh Bạc Liêu cũng ở mức thấp.
Theo dự báo của Đài Khí tượng Thủy văn Bến Tre, tình hình xâm nhập mặn trên địa bàn tỉnh đến ngày 4/2/2020, độ mặn 4%o xâm nhập cách các cửa sông khoảng 48 - 68km, độ mặn 1%o xâm nhập cách các cửa sông khoảng 63-83km.
Năm nay, Bến Tre xuống giống vụ đông xuân là 4.359 ha, đến nay, do ảnh hưởng của hạn, mặn nên bị ảnh hưởng khoảng 657 ha, tập trung ở Giồng Trôm (257 ha), Ba Tri (400 ha).
Tại tỉnh Trà Vinh, tình hình nước mặn trên địa bàn không ngừng tăng cao và xâm nhập sâu vào nội đồng. Hiện các huyện Cầu Ngang, Trà Cú, Châu Thành là những nơi có diện tích lúa đông xuân bị thiệt hại nhiều nhất với khoảng 8.000 ha bị thiệt hại từ 30 - 70% và mất trắng.
Ông Nguyễn Mạnh Thái, Trưởng Trạm bảo vệ thực vật huyện Châu Thành cho biết, toàn huyện có gần 12.000ha lúa đông xuân đang trong giai đoạn 25-50 ngày tuổi.  Hiện 100% diện tích lúa bị ảnh hưởng nặng hạn, mặn; trong đó, có gần 4.000ha lúa nguy cơ mất trắng.
Theo ông Đỗ Trưng, Giám đốc Công ty TNHH Một thành viên Quản lý và khai thác các công trình thủy lợi Trà Vinh, mặc dù đơn vị đã chủ động triển khai nhiều biện pháp vận hành đóng - mở hệ thống 48 cống thủy lợi để ngăn mặn, trữ ngọt nhưng do nước mặn năm nay xuất hiện sớm và xâm nhập nhanh vào sông rạch, kênh mương thủy lợi từ 60 - 70 km với độ mặn từ 3 - 10%o gây ảnh hưởng lớn đến diện tích lúa đông xuân và vườn cây ăn trái.
 Ước tính, có hơn 10.000ha lúa đông xuân nằm trong tình trạng khô hạn vì thiếu nước ngọt; trong đó, có khoảng hơn 5.000ha nguy cơ bị thiệt hại trắng.
Hiện tại ngành nông nghiệp các tỉnh ĐBSCL đang tập trung chỉ đạo các địa phương vận động, hỗ trợ nông dân triển khai biện pháp cứu lúa, giảm thiểu về thiệt hại.
Ông Nguyễn Thành Phước, Chi cục trưởng Chi cục Trồng trọt và Bảo vệ thực vật tỉnh Sóc Trăng cho biết, toàn tỉnh có 185.000 ha sản xuất vụ đông xuân 2019 - 2020, đến thời điểm này đã thu hoạch khoảng 70.000 ha, năng suất 6,1 tấn/ha.
Theo ông Phước, năm nay tỉnh đã chủ động xuống giống sớm để né hạn mặn, cơ bản không ảnh hưởng nhiều.
Tuy nhiên, diện tích đông xuân muộn trong vùng dự án thủy lợi Long Phú - Tiếp Nhật đã khép kín nên thiếu nước, ảnh hưởng hơn 3.600 ha ở huyện Long Phú.
""Hiện nay hầu hết trên địa bàn tỉnh Sóc Trăng mặn đã xâm nhập, tuy nhiên lo ngại nhất là hạn mặn kéo dài và sâu hơn, lên đến huyện Kế Sách, vùng đê bao chưa khép kín sẽ ảnh hưởng đến hàng nghìn héc ta cây ăn trái"", ông Phước cho hay.
Theo Tiền Phong",Hàng nghìn héc ta lúa đông xuân ở ĐBSCL có nguy cơ mất trắng do ảnh hưởng hạn mặn xâm nhập.
1,SẢN LƯỢNG GẠO CỦA INDONESIA GIẢM 8% TRONG NĂM 2019 VÌ THỜI TIẾT CỰC ĐOAN,10 | 02 | 2020,"""Trong năm 2019, thời tiết không thuận lợi. Những trận mưa to từ đầu năm đã gây ra tình trạng lũ lụt, sau đó là hạn hán kéo dài"", người đứng đầu cục thống kê Indonesia, ông Suhariyanto cho biết hôm 3/2.
Tổng diện tích thu hoạch trong năm 2019 đã giảm còn 10,68 triệu ha vì thời thiết cực đoan, giảm từ 11,38 triệu ha trong 2018, ông Suhariyanto nói thêm.
Trong khi đó, Bộ Đất đai và Qui hoạch đất Indonesia đã cập nhật tổng diện tích trồng lúa là 7,46 triệu ha dựa trên khảo sát được thực hiện trong hai năm 2018 và 2019. Diện tích trồng lúa tăng vì gồm một số cánh đồng được thu hoạch hai lần trong một năm, theo Reuters.
Tháng 9 năm ngoái, quốc gia rộng nhất Đông Nam Á đã quyết định thu mua gạo và đường từ Ấn Độ, một động thái giúp giảm thâm hụt thương mại giữa hai quốc gia và thúc đẩy khối lượng thương mại lên 50 tỉ USD vào năm 2025, Economic Times cho biết.
Quyết định nhập khẩu gạo và đường Ấn Độ của Jakarta vì chính quyền New Delhi mang tới sân chơi công bằng cho dầu cọ Indonesia bằng cách đánh thuế tương tự đối với dầu cọ Malaysia.
Theo Vietnambiz","Theo cơ quan thống kê Indonesia, quốc gia Đông Nam Á đã sản xuất 54,6 triệu tấn thóc trong năm 2019, giảm khoảng 8% từ 59,2 triệu tấn của một năm trước, vì thời tiết cực đoan."
1,THỊ TRƯỜNG GẠO NĂM 2019: NHU CẦU NHẬP KHẨU GẠO DỰ BÁO GIẢM,31 | 01 | 2020,"Tổ chức Lương thực và Nông nghiệp Liên Hiệp Quốc (FAO) cho biết, chỉ số giá gạo FAO (2002 - 04 = 100) trung bình đạt 224 điểm vào tháng 12, giảm 0,6% so với cùng kì 2018.
Tháng 12 trên thị trường thế giới, giá xuất khẩu gạo Ấn Độ tăng nhẹ trở lại từ mức thấp trong 3 năm do các nhà xuất khẩu tăng giá để bù đắp việc đồng rupee tăng. Nguồn cung thấp và nhu cầu tăng từ Cuba, Iraq và Philippines đã đẩy giá gạo Việt Nam tăng lên.
Gạo đồ 5% tấm của Ấn Độ được chào bán giá 358 - 363 USD/tấn, tăng nhẹ so với 356 – 362 USD/tấn đầu tháng 12 và là mức thấp nhất kể từ tháng 1/2017.
Gạo 5% tấm của Thái Lan tăng từ 394 – 410 USD/tấn lên 415- 419 USD/tấn. Gạo 5% tấm của Việt Nam tăng nhẹ ở 535 - 357 USD/tấn (FOB cảng Sài Gòn).
Tại Việt Nam, theo Tổng cục Hải quan cho biết, giá gạo xuất khẩu bình quân 2019 đạt 430 - 460 USD/tấn, thấp trong ba năm trở lại đây.
Đối với trong nước, Bộ NN&PTNT cho biết giá lúa, gạo tại Đồng bằng sông Cửu Long (ĐBSCL) diễn biến tăng, giảm trái chiều trong tháng 12.
Dự báo về sản lượng gạo toàn cầu 2020, FAO ước tính con số tiêu thụ gạo toàn cầu năm 2019 - 2020 vào khoảng 516,8 triệu tấn, tăng khoảng 0,2% so với mức 515,9 triệu tấn ước tính vào tháng 11/2019.
Bộ NN&PTNT cho rằng nhu cầu gạo nhập khẩu từ Việt Nam hiện đang giảm dần do các quốc gia khác đã và đang cơ cấu lại nền nông nghiệp để nâng cao khả năng tự cung cấp và đáp ứng phần nào nhu cầu lương thực nội địa. Đồng thời, Việt Nam đang gặp khó khăn trong việc tìm kiếm các đối tác nhập khẩu mới.
Theo Vietnambiz",Bộ NN&PTNT cho rằng nhu cầu nhập khẩu gạo từ Việt Nam tiếp tục giảm dần do các quốc gia khác đã và đang cơ cấu lại nền nông nghiệp nhằm nâng cao khả năng tự cung cấp và đáp ứng phần nào nhu cầu lương thực nội địa.
1,TỔNG HỢP MỘT SỐ THÔNG TIN VỀ LÚA GẠO TRONG TUẦN GẦN ĐÂY,03 | 02 | 2020,"Myanmar thu khoảng 80 triệu USD từ xuất khẩu gạo tấm trong 3,5 tháng
Liên đoàn Lúa gạo Myanmar (MRF) cho biết, kim ngạch xuất khẩu gạo tấm của nước này trong giai đoạn 1/10/2019 – 10/1/2020 đạt khoảng 80 triệu USD. Trong giai đoạn này, Myanmar xuất khẩu sang 46 thị trường, chủ yếu là Indonesia (22 triệu USD). Ba thị trường lớn khác là Senegal, Bỉ và Guinea.
Iraq kế hoạch thu mua 306.000 tấn gạo
Iraq là nhà nhập khẩu gạo lớn ở khu vực Trung Đông. Nước này cho biết đã hoàn thành việc thu mua 306.000 tấn gạo trong niên vụ 2019-2020.
WTO phê duyệt cho Hàn Quốc duy trì thuế nhập khẩu gạo 513%
Bộ Nông nghiệp Hàn Quốc ngày 28/1/2020 cho biết, Tổ chức Thương mại Thế giới (WTO) đã thông qua cho phép Hàn Quốc được duy trì mức thuế nhập khẩu gạo 513% như hiện nay (thuế này được áp dụng từ năm 2015).
WTO đã cấp phép 2 tháng sau khi Seoul đạt được các thỏa thuận với 5 nhà xuất khẩu gạo là Mỹ, Trung Quốc, Australia, Thái Lan và Việt Nam về việc duy trì thuế cao đối với gạo nhập khẩu.
Theo cam kết, Hàn Quốc có thể áp thuế nhập khẩu gạo cao nếu nhập vượt hạn ngạch 408.700 tấn. Trong hạn ngạch này, Trung Quốc có 157.195 tấn, Mỹ 132.304 tấn, Việt Nam 55.112 tấn, Thái Lan 28.494 tấn và Australia 15.595 tấn.
Tiêu thụ gạo của Hàn Quốc năm 2019 giảm xuống mức thấp nhất trong lịch sử, do sự thay đổi thói quen ăn uống. Tiêu thụ gạo trung bình người năm 2019 chỉ đạt 59,2 kg, giảm 3% so với năm trước đó và là lần đầu tiên giảm xuống dưới ngưỡng 60 kg.
Theo vinanet.vn","Myanmar thu khoảng 80 triệu USD từ xuất khẩu gạo tấm trong 3,5 tháng Iraq kế hoạch thu mua 306.000 tấn gạo WTO phê duyệt cho Hàn Quốc duy trì thuế nhập khẩu gạo 513%"
1,THÁI LAN ĐẤU TRANH ĐỂ GIÀNH LẠI DANH HIỆU QUỐC GIA XUẤT KHẨU GẠO LỚN NHẤT THẾ GIỚI,17 | 02 | 2020,"Phát biểu sau cuộc họp với đại diện của Cục Gạo, Bộ Ngoại thương, Hiệp hội các nhà xuất khẩu gạo Thái Lan và người bán gạo, Thứ trưởng Bộ Nông nghiệp và Hợp tác xã Praphat Phothasoothon cho biết các cơ quan và công ty đã đồng ý giải quyết một số vấn đề còn tồn đọng đối với xuất khẩu gạo, vì Thái Lan hiện không sản xuất các loại gạo mới đang được giao dịch trên thị trường toàn cầu.
Hạn hán nghiêm trọng đang gây thêm áp lực cho các loại cây trồng có hiệu quả kinh tế cao của Thái Lan (lúa, cao su, đường) và nền nông nghiệp sử dụng 11 triệu nhân công của nước này.
Xuất khẩu gạo toàn cầu niên vụ 2018 - 2019. Ảnh: Thailand Business News
Cạnh tranh mạnh mẽ hơn từ Việt Nam và Campuchia
Thái Lan đã chứng kiến sự cạnh tranh mạnh mẽ hơn từ Việt Nam, Campuchia và Myanmar. Năm 2019, sản lượng gạo xuất khẩu hàng năm của Thái Lan đã giảm từ 10 triệu tấn xuống chỉ còn 7,5 triệu tấn.
Hầu hết loại gạo Thái đều là gạo trắng và cứng nên không có nhu cầu ở nước ngoài. Trong thời gian tới, quốc gia này sẽ cải thiện sự đa dạng để đáp ứng nhu cầu của khách hàng.
Ứng phó với hạn hán và kế hoạch phân vùng trang trại lúa
Cũng tại cuộc họp, các cơ quan liên quan đã được chỉ định để hoàn thành việc xây dựng kế hoạch phân vùng hạn hán và trang trại lúa trong hai tuần và sẽ được thực hiện trong niên vụ tiếp theo bắt đầu vào khoảng tháng 5/2020.
Cục Gạo đã được chỉ định tăng tốc nghiên cứu các giống lúa mới, ngoài các giống được giới thiệu gần đây, để đáp ứng nhu cầu thay đổi nhanh chóng của người tiêu dùng. Những dự án nghiên cứu này sẽ nhận được tài trợ của chính phủ.
Đối với những khu vực không phù hợp để trồng lúa, Cục Phát triển chăn nuôi sẽ tổ chức chiến dịch xúc tiến nghề nghiệp trong 3 năm. Điều này sẽ giúp giảm tổng số trang trại lúa trong nước, để ngăn chặn tình trạng thừa cung, ảnh hưởng đến giá cả.
Các loại gạo mềm hiện đang có nhu cầu lớn hơn từ khách hàng toàn cầu, ví dụ như giống PSL 07023-CNT-18-2-1-3, đang được gieo trồng trong một dự án thí điểm của nông dân ở tỉnh Phichit.
Theo Kinh tế và Tiêu dùng","Sau khi mất vị trí xuất khẩu gạo số một toàn cầu trong ba năm, Bộ Nông nghiệp và Hợp tác xã Thái Lan đã gặp gỡ các cơ quan liên quan và các nhà xuất khẩu gạo để tìm ra biện pháp lấy lại vị trí hàng đầu, theo tờ Thailand Business News."
1,"HOẠT ĐỘNG XUẤT KHẨU GẠO TẠI VIỆT NAM, THÁI LAN BỊ THIỆT HẠI BỞI VIRUS CORONA",11 | 02 | 2020,"Xuất khẩu gạo Ấn Độ chạm đáy 8 năm vì giá tăng khiến nhu cầu ảm đạm
Theo Reuters, giá gạo đồ 5% tấm tại Ấn Độ ghi nhận dao động trong khoảng 370 - 375 USD/tấn trong tuần này, mức cao nhất kể từ tuần cuối cùng của tháng 9/2019.
Giá gạo xuất khẩu tăng từ 369 - 373 USD/tấn của tuần trước, nhờ đồng rupee tăng giá.
""Nhu cầu đang ở mức tốt cho mùa vụ mới. Giá cũng cạnh tranh"", một nhà xuất khẩu có trụ sở tại Kakinada tại miền Nam bang Andhra Pradesh.
Nhu cầu phục hồi sau khi xuất khẩu gạo trong năm 2019 giảm 18,1% so với một năm trước xuống mức thấp nhất trong 8 năm, vì nhu cầu từ những người mua chính ở châu Á và châu Phi suy yếu dưới ảnh hưởng của mức giá cao, dữ liệu chính thức từ chính phủ Ấn Độ chỉ ra.
Quốc gia Nam Á đã xuất khẩu 9,87 triệu tấn gạo trong năm ngoái, mức thấp nhất kể từ năm 2011, và giảm từ 12,05 triệu tấn trong 2018.
Giá gạo Thái Lan giảm trong tuần này
Cụ thể, giá gạo thường 5% tấm tại Thái Lan giảm còn 425 - 439 USD/tấn trong tuần này từ 432 - 453 USD/tấn của tuần trước, vì đồng nội tệ yếu.
Đồng bath Thái giảm xuống mức thấp nhất 7 tháng hôm 30/1, vì chịu ảnh hưởng bởi sự lây lan của virus corona - cũng là mối đe dọa đối với ngành du lịch của quốc gia Đông Nam Á, động lực chính của sự tăng trưởng.
Giới thương lái dự báo giá gạo xuất khẩu tiếp tục giảm vì sự bùng phát của virus đã khiến 563 người tại Trung Quốc đại lục thiệt mạng.
Trung Quốc là thị trường xuất khẩu lớn thứ hai của Thái Lan trong năm ngoái. Khách du lịch Trung Quốc cũng chiếm hơn một phần tư tổng khách du lịch đến quốc gia Đông Nam Á mỗi năm.
Giá gạo trong nước tại Thái Lan duy trì ở mức cao vì hạn hán kéo dài ảnh hưởng tiêu cực tới nguồn cung, theo một thương nhân tại Bangkok.
""Dịch do virus corona đang diễn ra tại Trung Quốc cũng dẫn tới sự gián trong hoạt động giao hàng của người nông dân Việt Nam sang Trung Quốc, trong đó có cả gạo"", một nhà giao dịch tại TP HCM cho biết.
Mặc dù vậy, tác động của xuất khẩu bị hạn chế phần nào khi Trung Quốc đã giảm nhập khẩu gạo từ Việt Nam trong hơn một năm.
Tại Việt Nam, giá gạo 5% tấm tăng 10 - 20 USD/tấn so với tuần trước lên 355 - 360 USD/tấn từ 345 USD/tấn.
""Nhu cầu đối với gạo 5% tấm vẫn mạnh nhưng diện tích trồng lúa tại Việt Nam đang giảm, chủ yếu vì sự nhiễm mặn"", một thương nhân chia sẻ.
Theo các thương lái, người nông dân tại vùng đồng bằng sông Cửu Long đã thu hoạch khoảng 30% vụ đông xuân.
Trong khi đó, Bangladesh đã cấp hỗ trợ tiền mặt bằng 15% giá trị xuất khẩu gạo cho các nhà giao dịch nhằm cạnh tranh với đối thủ và bảo vệ người nông dân đang gặp khó khăn với mức giá thấp, Bộ trưởng Nông nghiệp Abdur Razzak cho biết hôm 5/2.
""Chúng tôi muốn hỗ trợ ít nhất 20% tiền mặt. Hiện tại rất khó để cạnh tranh với các đối thủ"", một thương nhân chia sẻ.
Theo Kinh tế và Tiêu dùng","Giá gạo xuất khẩu tại Ấn Độ tăng lên mức cao nhất hơn 4 tháng trong tuần này, nhờ nhu cầu tốt từ các quốc gia châu Phi. Trong khi đó, các thị trường tại Thái Lan và Việt Nam gặp khó khăn với sự bùng phát của virus corona mới."
1,SÔI ĐỘNG THỊ TRƯỜNG XUẤT KHẨU GẠO,04 | 02 | 2020,"Đông Xuân là vụ lúa chính của Đồng bằng sông Cửu Long (ĐBSCL), chất lượng gạo tốt nên các thị trường truyền thống, như Malaysia và Philippines… đang đẩy mạnh mua vào, nhất là Philippines khiến cho thị trường xuất khẩu khá sôi động.
Tín hiệu tốt ngay từ đầu năm
Theo Tổng cục Hải quan, tháng 1/2020, xuất khẩu gạo ước đạt 559,61 triệu tấn, trị giá 270,26 triệu USD, so với tháng 12/2019 tăng 12,01% về lượng và tăng 38,96% về giá trị. So với cùng kỳ năm 2019 tăng 28,05% về lượng và tăng 38,38% về kim ngạch.
Từ đầu vụ Đông Xuân đến nay giá lúa trong nước ổn định, lượng bán ra nhiều nên thị trường xuất khẩu cũng sôi động, từ trước Tết các doanh nghiệp đã ký nhiều hợp đồng bán gạo cho Philippines, Malaysia. Đến nay, các nước này vẫn tiếp tục mua vào vì giá gạo Việt Nam đang rất cạnh tranh.
Hiện gạo (IR 50404) loại 5% tấm dao động từ 340 - 350 USD/tấn (FOB). Loại 15% tấm và 25% tấm thấp hơn 10 USD/tấn cho mỗi loại. Gạo DT8 và OM 5451 đang dao dịch ở mức 400 USD/tấn, vào thời điểm tháng 11, tháng 12/2019 các loại gạo này có giá 470 - 480 USD/tấn. Đây là hai loại gạo mà thị trường Philippines rất chuộng, giá thấp nên các thương nhân Philippines đang đẩy mạnh mua vào.
Năm 2019, Việt Nam xuất khẩu sang Philippines trên 2 triệu tấn gạo, dự kiến, năm 2020 Philippines sẽ mua lượng gạo bằng hoặc cao hơn năm 2019. Thị trường châu Phi mua khoảng 1 triệu tấn gạo/năm, Malaysia sẽ nhập khẩu khoảng 500.000 tấn/năm, từ tháng 12/2019 nước này đã triển khai mua gạo từ Việt Nam và Thái Lan, nhưng do giá gạo Việt Nam cạnh tranh hơn Thái Lan nên Malaysia chủ yều mua gạo của Việt Nam.
Mỗi năm Việt Nam xuất khẩu sang Cuba (G2G) từ 300.000 đến 400.000 tấn gạo/năm. Iraq cũng mua gạo khoảng 300.000 tấn gạo/năm. Trung Quốc chỉ mua 400 ngàn tấn/năm… Ngoài ra, các doanh nghiệp còn xuất khẩu đi các thị trường khác.
Hạn mặn sẽ ảnh hưởng đến năng suất và lượng gạo xuất khẩu
Ông Đỗ Hà Nam, Phó Chủ tịch Hiệp hội Lương thực Việt Nam cho biết, năm 2020 Trung Quốc tiếp tục siết nhập khẩu gạo từ Việt Nam nên cấp hạn ngạch bằng với 2019. Năm 2019, Việt Nam xuất khẩu sang Trung Quốc khoảng 400.000 tấn gạo, trong đó xuất theo hạn ngạch hơn 300.000 tấn gạo hạt dài, một số khác là đi hàng thuế.
Dự kiến, năm 2020 Việt Nam sẽ xuất khẩu bằng hoặc nhỉnh hơn năm 2019, nhưng do tình hình hạn mặn diễn biến phức tạp như hiện nay có khả năng năng suất và sản lượng lúa sẽ bị ảnh hưởng và tác động đến lượng gạo xuất khẩu.
Ông Nguyễn Chánh Trung, Giám đốc điều hành mảng gạo Tân Long Group cho biết, nếu xuất khẩu ở mức 6 triệu tấn/năm là hợp lý sẽ không thừa, nhưng 5,5 triệu tấn thì khó khăn cho doanh nghiệp.
  Hiện nay, nhu cầu gạo cơ bản khá ổn định và thị trường gạo xuất khẩu là khá sáng, Tân Long là doanh nghiệp xuất khẩu gạo lớn với hệ thống kho đủ lớn, vấn đề chúng tôi quan tâm là mua được hàng hóa đúng chất lượng để kinh doanh và có mức giá phù hợp với nhu cầu thị trường.
“Chúng tôi có đầu ra và khách hàng cũng đã đặt hàng nguyên tắc, nên phải tìm hàng đúng với yêu cầu của khách và trong quá trình đó sẽ phải kích thích nông dân trồng đúng loại hàng hóa để bao tiêu. Qua đó sẽ xác lập được một diện tích trồng lúa để ra được nguồn cung tương đối không gây hiếm hàng”, ông Trung nhấn mạnh.
Còn theo một doanh nghiệp ở Đồng Tháp, khu vực ĐBSCL đã xuất hiện một số vùng thiếu nước, cây lúa bị chết, vì vậy, hạn mặn có thể ảnh hưởng đến năng suất, sản lượng lúa. Thị trường xuất khẩu đang rất khả quan nhưng với người nông dân giá lúa từ 4.500 đến 4.600 đồng/kg như hiện nay là thấp và bà con không hài lòng. Song, giá lúa có thể sẽ tăng lên khi qua thu hoạch rộ.
Theo bizlive.vn","Vụ lúa Đông Xuân 2019-2020 ở ĐBSCL đã thu hoạch từ tháng 12/2019, trong tháng 2/2020 sẽ thu hoạch rộ, đến tháng 3 tiến độ sẽ giảm dần."
